{
  "schema_version": "financial_fact_v1",
  "id": "fact_aapl_rd_split_2023_unavailable",
  "company": "AAPL",
  "concept": "ResearchAndDevelopmentDirectLaborExpense",
  "value": null,
  "unit": "USD",
  "currency": "USD",
  "period_start": "2022-10-01",
  "period_end": "2023-09-30",
  "instant": null,
  "filing_accession": "0000320193-23-000106",
  "availability_time": "2023-11-03T18:00:00Z",
  "retrieval_time": "2023-11-03T19:00:00Z",
  "source_location": "https://www.sec.gov/ix?doc=/Archives/edgar/data/320193/000032019323000106/aapl-20230930.htm#Note1",
  "accounting_basis": "US-GAAP",
  "extractor_version": "sec_facts_v1.0",
  "supersedes": null,
  "kind": "reported",
  "missing_reason": "Company does not disclose direct labor breakdown for R&D in SEC filings",
  "dimensions": null,
  "metadata": {
    "disclosed": false
  }
}
