{
  "schema_version": "financial_fact_v1",
  "id": "fact_aapl_rev_2024_q1",
  "company": "AAPL",
  "concept": "Revenues",
  "value": 119575000000.0,
  "unit": "USD",
  "currency": "USD",
  "period_start": "2023-10-01",
  "period_end": "2023-12-30",
  "instant": null,
  "filing_accession": "0000320193-24-000006",
  "availability_time": "2024-02-02T16:30:00Z",
  "retrieval_time": "2024-02-02T17:00:00Z",
  "source_location": "https://www.sec.gov/ix?doc=/Archives/edgar/data/320193/000032019324000006/aapl-20231230.htm#Item1",
  "accounting_basis": "US-GAAP",
  "extractor_version": "sec_facts_v1.0",
  "supersedes": null,
  "kind": "reported",
  "missing_reason": null,
  "dimensions": null,
  "metadata": {
    "form": "10-Q",
    "fiscal_quarter": "Q1",
    "fiscal_year": 2024
  }
}
