{
  "schema_version": "financial_fact_v1",
  "id": "fact_aapl_segment_iphone_rev_2023",
  "company": "AAPL",
  "concept": "RevenueFromContractWithCustomerExcludingAssessedTax",
  "value": 200583000000.0,
  "unit": "USD",
  "currency": "USD",
  "period_start": "2022-10-01",
  "period_end": "2023-09-30",
  "instant": null,
  "filing_accession": "0000320193-23-000106",
  "availability_time": "2023-11-03T18:00:00Z",
  "retrieval_time": "2023-11-03T19:00:00Z",
  "source_location": {
    "url": "https://www.sec.gov/ix?doc=/Archives/edgar/data/320193/000032019323000106/aapl-20230930.htm",
    "table": "Note 12 - Segment Information and Geographic Data",
    "offset": 45120
  },
  "accounting_basis": "US-GAAP",
  "extractor_version": "sec_facts_v1.0",
  "supersedes": null,
  "kind": "reported",
  "missing_reason": null,
  "dimensions": {
    "ProductOrServiceAxis": "iPhoneMember",
    "StatementBusinessSegmentsAxis": "AmericasMember"
  },
  "metadata": {
    "segment_breakdown": true
  }
}
